<?xml version="1.0" encoding="UTF-8"?><!DOCTYPE Root SYSTEM "MappingTable.dtd"><Root File-format="MDF" Menu-name="SDK Image Extraction" Mac-creator="" Mac-type="TEXT" Win-suffix="xxx.txt" Encode-out="Utf-8-out">	<!--	ADOBE SYSTEMS INCORPORATED	Copyright 2003 Adobe Systems Incorporated	All Rights Reserved		NOTICE:  This Notice only applies to this file or any portion thereof.	Adobe permits you to use, modify, and distribute this file in accordance	with the terms and conditions of the Adobe license agreement accompanying	it ("Agreement").  Additionally, Adobe grants you a nonexclusive,	nontransferable, royalty-free license to use, modify and distribute	all or any portion of this file.  Where the terms of this Notice	and the terms of the Agreement differ, the terms of this Notice	shall control.  All other terms and conditions of the Agreement	remain unchanged and have full force and effect.  If you have received	this file from a source other than Adobe, then your use, modification,	or distribution of it requires the prior written permission of Adobe.-->	<!-- This example will extract images into a sub-folder and create a plain text file of the images extracted, along with their width and height. -->	<Define-proc-list Name="Figure-attributes">		<!-- We get the height and the width from either the layout or the document structure -->		<Proc-var Pdf-var="Width" Owner="Layout" Type="Fixed" Inherit="Not-inherited" Condition="Has-value">			<Emit-string SP-Before="Yes">width=&quot;</Emit-string>			<Proc-pixels/>			<Emit-string>&quot;</Emit-string>		</Proc-var>		<Proc-var Pdf-var="Width" Owner="Layout" Type="Fixed" Inherit="Not-inherited" Condition="No-value">			<Proc-var Pdf-var="Width" Owner="Structelem" Type="Fixed" Inherit="Not-inherited" Condition="Has-value">				<Emit-string SP-Before="Yes">Width=&quot;</Emit-string>				<Proc-pixels/>				<Emit-string>&quot;</Emit-string>			</Proc-var>		</Proc-var>		<Proc-var Pdf-var="Height" Owner="Layout" Type="Fixed" Inherit="Not-inherited" Condition="Has-value">			<Emit-string SP-Before="Yes">height=&quot;</Emit-string>			<Proc-pixels/>			<Emit-string>&quot;</Emit-string>		</Proc-var>		<Proc-var Pdf-var="Height" Owner="Layout" Type="Fixed" Inherit="Not-inherited" Condition="No-value">			<Proc-var Pdf-var="Height" Owner="Structelem" Type="Fixed" Inherit="Not-inherited" Condition="Has-value">				<Emit-string SP-Before="Yes">height=&quot;</Emit-string>				<Proc-pixels/>				<Emit-string>&quot;</Emit-string>			</Proc-var>		</Proc-var>	</Define-proc-list>		<Define-event-list Name="content-elements">		<!-- For images, we dump their attributes. -->		<Event Inf-type="Struct-elem" Name-type="Structure-role" Node-name="Figure" Alternate-name="Img" Node-content="Has-kids" Event-class="Enter">			<Emit-string SP-After="Yes">Extracted image:</Emit-string>			<Call-proc-list Name="Figure-attributes"/>			<Emit-string SP-Before="Yes">file=&quot;</Emit-string>			<Proc-image-content/>			<Emit-string NL-After="Yes">&quot;</Emit-string>		</Event>		<!-- walk the structure... -->		<Event Inf-type="Struct-elem" Name-type="Any" Node-content="Has-kids" Event-class="Enter">			<Walk-children Use-event-list="content-elements"/>		</Event>	</Define-event-list>	<!-- Walk the structure tree -->	<Walk-structure Use-event-list="content-elements"/></Root>