<?xml version="1.0" encoding="UTF-8"?><!DOCTYPE Root SYSTEM "MappingTable.dtd"><Root File-format="MDF" Menu-name="SDK DocInfo Extraction" Mac-creator="" Mac-type="TEXT" Win-suffix="DocInfo.txt" Encode-out="Utf-8-out">	<!--	ADOBE SYSTEMS INCORPORATED	Copyright 2003 Adobe Systems Incorporated	All Rights Reserved		NOTICE:  This Notice only applies to this file or any portion thereof.	Adobe permits you to use, modify, and distribute this file in accordance	with the terms and conditions of the Adobe license agreement accompanying	it ("Agreement").  Additionally, Adobe grants you a nonexclusive,	nontransferable, royalty-free license to use, modify and distribute	all or any portion of this file.  Where the terms of this Notice	and the terms of the Agreement differ, the terms of this Notice	shall control.  All other terms and conditions of the Agreement	remain unchanged and have full force and effect.  If you have received	this file from a source other than Adobe, then your use, modification,	or distribution of it requires the prior written permission of Adobe.-->	<!-- This sample extracts the meta-data from the document, saving it into a file called x.DocInfo.txt. -->	<!-- The event list deals with metadata items. 	 -->	<Define-proc-list Name="dump-metadata">		<Proc-var Pdf-var="Title" Owner="Metadata" Type="String" Inherit="Not-inherited" Condition="Has-value">			<Emit-string>Title=&quot;</Emit-string>			<Proc-string/>			<Emit-string NL-After="Yes">&quot;</Emit-string>		</Proc-var>		<Proc-var Pdf-var="Author" Owner="Metadata" Type="String" Inherit="Not-inherited" Condition="Has-value">			<Emit-string>Author=&quot;</Emit-string>			<Proc-string/>			<Emit-string NL-After="Yes">&quot;</Emit-string>		</Proc-var>		<Proc-var Pdf-var="Subject" Owner="Metadata" Type="String" Inherit="Not-inherited" Condition="Has-value">			<Emit-string>Subject=&quot;</Emit-string>			<Proc-string/>			<Emit-string NL-After="Yes">&quot;</Emit-string>		</Proc-var>		<Proc-var Pdf-var="Creator" Owner="Metadata" Type="String" Inherit="Not-inherited" Condition="Has-value">			<Emit-string>Creator=&quot;</Emit-string>			<Proc-string/>			<Emit-string NL-After="Yes">&quot;</Emit-string>		</Proc-var>		<Proc-var Pdf-var="CreationDate" Owner="Metadata" Type="String" Inherit="Not-inherited" Condition="Has-value">			<Emit-string>Date=&quot;</Emit-string>			<Proc-string/>			<Emit-string NL-After="Yes">&quot;</Emit-string>		</Proc-var>		<Proc-var Pdf-var="ModDate" Owner="Metadata" Type="String" Inherit="Not-inherited" Condition="Has-value">			<Emit-string>Date Modified=&quot;</Emit-string>			<Proc-string/>			<Emit-string NL-After="Yes">&quot;</Emit-string>		</Proc-var>	</Define-proc-list>	<!-- Walk the meta-data tree -->	<Walk-doc-metadata Use-proc-list="dump-metadata"/></Root>